<?xml version="1.0" encoding="utf-8"?>
<xs:schema id="students"
    targetNamespace="http://webdude.eu/students.xsd"
    elementFormDefault="qualified"
    xmlns="http://webdude.eu/students.xsd"
    xmlns:mstns="http://webdude.eu/students.xsd"
    xmlns:xs="http://www.w3.org/2001/XMLSchema">
  <xs:element name="students">
    <xs:complexType>
      <xs:sequence>
        <xs:element maxOccurs="unbounded" name="student">
          <xs:complexType>
            <xs:sequence>
              <xs:element name="name" type="xs:string" />
              <xs:element name="sex" type="xs:string" />
              <xs:element name="birthdate" type="xs:dateTime" />
              <xs:element name="phone" type="xs:decimal" />
              <xs:element name="email" type="xs:string" />
              <xs:element name="course" type="xs:string" />
              <xs:element name="speciality" type="xs:string" />
              <xs:element name="facultyNumber" type="xs:unsignedInt" />
              <xs:element name="takenExams">
                <xs:complexType>
                  <xs:sequence>
                    <xs:element maxOccurs="unbounded" name="exam">
                      <xs:complexType>
                        <xs:sequence>
                          <xs:element name="name" type="xs:string" />
                          <xs:element name="tutor" type="xs:string" />
                          <xs:element name="score" type="xs:byte" />
                        </xs:sequence>
                      </xs:complexType>
                    </xs:element>
                  </xs:sequence>
                </xs:complexType>
              </xs:element>
              <xs:element name="enrollmentInformation">
                <xs:complexType>
                  <xs:sequence>
                    <xs:element name="date" type="xs:string" />
                    <xs:element name="score" type="xs:unsignedByte" />
                  </xs:sequence>
                </xs:complexType>
              </xs:element>
              <xs:element name="endorsements">
                <xs:complexType>
                  <xs:sequence>
                    <xs:element maxOccurs="unbounded" name="endorsement">
                      <xs:complexType>
                        <xs:sequence>
                          <xs:element name="courseName" type="xs:string" />
                          <xs:element name="certified" type="xs:boolean" />
                        </xs:sequence>
                      </xs:complexType>
                    </xs:element>
                  </xs:sequence>
                </xs:complexType>
              </xs:element>
            </xs:sequence>
          </xs:complexType>
        </xs:element>
      </xs:sequence>
      <xs:attribute name="name" type="xs:string" use="required" />
    </xs:complexType>
  </xs:element>
</xs:schema>